{
  "$schema": "https://json-schema.org/draft/2020-12/schema",
  "$id": "https://northstar.invalid/schemas/lifecycle-generation-receipt.v1.json",
  "title": "Northstar generation receipt v1",
  "description": "Durable live machine tombstone for one closed generation, written at .northstar/lifecycle/v1/generations/gNN.json by compaction. It carries the canonical terminal task summaries, the source task-set digest the closure record pinned, and the closure digest as provenance; the detailed per-task records are removed and remain only in Git history. It is valid only beside the exact closure record it names, so a stale closure, malformed receipt, or uncovered fragment fails closed before any deletion.",
  "type": "object",
  "required": ["schema_version", "generation", "source_digest", "closure_digest", "tasks"],
  "properties": {
    "schema_version": { "const": "northstar.lifecycle.generation-receipt.v1" },
    "generation": {
      "type": "string",
      "pattern": "^g[0-9]{2}$"
    },
    "source_digest": {
      "description": "Digest of the sorted terminal task summaries the closure record pinned. Recomputed from the full fragment set at first compaction and never from a partial set.",
      "type": "string",
      "pattern": "^sha256:[0-9a-f]{64}$"
    },
    "closure_digest": {
      "description": "Digest of the exact closure record that authorized this receipt, so reopening or rewriting closure authority invalidates it.",
      "type": "string",
      "pattern": "^sha256:[0-9a-f]{64}$"
    },
    "tasks": {
      "description": "Exact terminal task entries, sorted by task id. Every remaining fragment must match one entry exactly before it may be deleted.",
      "type": "array",
      "minItems": 1,
      "uniqueItems": true,
      "items": { "$ref": "#/$defs/taskEntry" }
    }
  },
  "additionalProperties": false,
  "$defs": {
    "taskEntry": {
      "type": "object",
      "required": ["task_id", "revision", "digest", "status", "merge_commit"],
      "properties": {
        "task_id": {
          "type": "string",
          "pattern": "^g[0-9]{2}\\.[0-9]{3}$"
        },
        "revision": {
          "type": "integer",
          "minimum": 1
        },
        "digest": {
          "type": "string",
          "pattern": "^sha256:[0-9a-f]{64}$"
        },
        "status": {
          "enum": ["complete", "cancelled", "superseded"]
        },
        "merge_commit": {
          "type": ["string", "null"],
          "pattern": "^[0-9a-f]{40}$|^[0-9a-f]{64}$"
        }
      },
      "additionalProperties": false
    }
  }
}
