{"closure_digest":"sha256:0ad119a8cce322168fc07a7922f547b549b2078aa713f40084f0af42cdcb4b0b","generation":"g03","schema_version":"northstar.lifecycle.generation-receipt.v1","source_digest":"sha256:8252334e80fc4d0c4d6588a6e10598ac6027836f0bbae073ddc79363607bb764","tasks":[{"digest":"sha256:025066786b2d9af4821307a2b06b15b6cab8bf47a4a816db22bed66b9faa8c9b","merge_commit":"64f953e58547f7d9a8236a1cfe588ea5099fc66b","revision":8,"status":"complete","task_id":"g03.006"},{"digest":"sha256:a5b8006f700e791ff4bb68f504746a9f2431bb1711abd70292673e536a80b9ad","merge_commit":"0c0b1aec1b3a8ed36082f89ebc19850f6461e449","revision":8,"status":"complete","task_id":"g03.007"},{"digest":"sha256:888d75786d747f9965efa51b4b492c005aaf967a8f6504715e3b6be0f2760099","merge_commit":"21ff2fac4132aacfbb1d223ad46c379634d5ae58","revision":8,"status":"complete","task_id":"g03.008"},{"digest":"sha256:c8a09f2d3daad05e3b90235bc50f256c3932eeddaee668adecd9dad1183ac8e2","merge_commit":"42e6583dd413c513098d37b75f8ea8e523f9aa17","revision":8,"status":"complete","task_id":"g03.009"},{"digest":"sha256:109f4252bc5259b1cc87938aed24095f99dcf687d9236c93b32d1bd5e7ce537d","merge_commit":"4d7a2bf24de711e2eef8cb03053452b637d96bab","revision":8,"status":"complete","task_id":"g03.010"},{"digest":"sha256:b006beb373606185905bfa5b56fd4a1f87dc3accb80141a82be312efdd5206dc","merge_commit":"607830216918544fac98cbe4e5f103df7823bd87","revision":8,"status":"complete","task_id":"g03.011"},{"digest":"sha256:2ea341f845521a3162fc405e6528fb40d08b4e30b555b3de3af819f3c8bfc649","merge_commit":"c83fda38381d088f9e3b1e2a7750cb7a71a06185","revision":8,"status":"complete","task_id":"g03.012"},{"digest":"sha256:b04543c372ffeb75b3fd0813e7f541f216d22f3c6bd3cb03dcd5e175ea225374","merge_commit":"83adb696b7e67dc152bc5ddd0885ca61d575d0fa","revision":8,"status":"complete","task_id":"g03.013"},{"digest":"sha256:625cb1913c3e02eedff7bfde13b7739bab45ac45d5017c550df775b210ab95dd","merge_commit":"a1ad2c870aa8bf44929037eaa7864180e39912d7","revision":8,"status":"complete","task_id":"g03.014"},{"digest":"sha256:c1035ad4e0adc5dec9a9723c622acadf1e2ab689883f1711e4f2c435ac519df8","merge_commit":"50d4495572eaf6a0c2f670038193a6be67d02c1e","revision":8,"status":"complete","task_id":"g03.015"},{"digest":"sha256:a841a07bb97a64cf4d2bc3f5d3fb4f76c990d07c46d47fded5db68aa6c9c16be","merge_commit":"a3cdf9660a11a417b06cb849a62d2159e0e8d695","revision":8,"status":"complete","task_id":"g03.016"},{"digest":"sha256:4fc88cc4206d2d2427a825759ee29a12540285a0816248e2d3feda85207cf988","merge_commit":"664320553b7105a14f1bf07638752effc0409936","revision":8,"status":"complete","task_id":"g03.017"},{"digest":"sha256:f2d73b780dd1f0701b02c078dd8a255629f16a647d90d1d7ddea9138c07f58c3","merge_commit":"d870068c397e9525be0c75b94348ba3383008f48","revision":8,"status":"complete","task_id":"g03.018"},{"digest":"sha256:76d6a4c9b2956db2e27f351809da4cc0222eeac31ef4d4789468b76ce198bc30","merge_commit":"99241b925ade87d4f3cfe3cd57e39328b4ad79ff","revision":8,"status":"complete","task_id":"g03.019"},{"digest":"sha256:da733286412d8cdf4c1e56ba0e48ea434e92539dd6da3f84b642da8ad809e3be","merge_commit":"1161357fcabf40ee13163a989353cf981a195030","revision":8,"status":"complete","task_id":"g03.020"},{"digest":"sha256:ba3422694b358b8e89e0a3ae00f65c9efd7cc84b64d272af8cab477d939feffa","merge_commit":"e95338a7ed9cc17d097bf77a9446ac14a4ab8b70","revision":8,"status":"complete","task_id":"g03.021"},{"digest":"sha256:0cb64c8b842c52c3574d858925968e4f643985924a38a7fdfe53043e7ef26adf","merge_commit":"3f4028d0345b14977f8e40484da657b04bf7fca6","revision":8,"status":"complete","task_id":"g03.022"}]}
